{
  "divergence_clusters": [
    {
      "attribute": "method_name",
      "finding_id": "fe2697a2ca7daa80",
      "variants": [
        {
          "occurrence_count": 9,
          "resources_methods": [
            "calls.add",
            "closingDays.add",
            "companies.add",
            "contacts.add",
            "incomingCreditNotes.add",
            "incomingInvoices.add",
            "products.add",
            "receipts.add",
            "timeTracking.add"
          ],
          "value": "add"
        },
        {
          "occurrence_count": 19,
          "resources_methods": [
            "customFieldDefinitions.create",
            "dayOffTypes.create",
            "dealPhases.create",
            "dealPipelines.create",
            "deals.create",
            "emailTracking.create",
            "events.create",
            "legacyMilestones.create",
            "legacyProjects.create",
            "notes.create",
            "projectGroups.create",
            "projectMaterials.create",
            "projectTasks.create",
            "projects.create",
            "quotations.create",
            "reservations.create",
            "subscriptions.create",
            "tasks.create",
            "tickets.create"
          ],
          "value": "create"
        },
        {
          "occurrence_count": 1,
          "resources_methods": [
            "invoices.draft"
          ],
          "value": "draft"
        }
      ]
    },
    {
      "attribute": "param_shape",
      "finding_id": "93f5f2e8211ae060",
      "variants": [
        {
          "occurrence_count": 56,
          "resources_methods": [
            "activityTypes.list",
            "bookkeepingSubmissions.list",
            "businessTypes.list",
            "callOutcomes.list",
            "calls.list",
            "closingDays.list",
            "commercialDiscounts.list",
            "companies.list",
            "contacts.list",
            "creditNotes.list",
            "customFieldDefinitions.list",
            "dealPhases.list",
            "dealPipelines.list",
            "dealSources.list",
            "deals.list",
            "departments.list",
            "documentTemplates.list",
            "emailTracking.list",
            "events.list",
            "expenses.list",
            "files.list",
            "invoices.list",
            "legacyMilestones.list",
            "legacyProjects.list",
            "levelTwoAreas.list",
            "lostReasons.list",
            "mailTemplates.list",
            "meetings.list",
            "notes.list",
            "orders.list",
            "paymentMethods.list",
            "paymentTerms.list",
            "plannableItems.list",
            "priceLists.list",
            "productCategories.list",
            "products.list",
            "projectGroups.list",
            "projectLines.list",
            "projectMaterials.list",
            "projectTasks.list",
            "projects.list",
            "quotations.list",
            "reservations.list",
            "subscriptions.list",
            "tags.list",
            "tasks.list",
            "taxRates.list",
            "teams.list",
            "ticketStatus.list",
            "tickets.list",
            "timeTracking.list",
            "unitsOfMeasure.list",
            "users.list",
            "webhooks.list",
            "withholdingTaxRates.list",
            "workTypes.list"
          ],
          "value": "RequestBody<\"<endpoint>\">"
        },
        {
          "occurrence_count": 1,
          "resources_methods": [
            "dayOffTypes.list"
          ],
          "value": "undefined"
        }
      ]
    },
    {
      "attribute": "return_envelope",
      "finding_id": "f0279509226fb8cb",
      "variants": [
        {
          "occurrence_count": 3,
          "resources_methods": [
            "incomingCreditNotes.registerPayment",
            "incomingInvoices.registerPayment",
            "receipts.registerPayment"
          ],
          "value": "single"
        },
        {
          "occurrence_count": 1,
          "resources_methods": [
            "invoices.registerPayment"
          ],
          "value": "void"
        }
      ]
    }
  ],
  "generated_for_branch": "001-sdk-quality-audit",
  "resources": [
    {
      "class_name": "AccountsResource",
      "file": "src/resources/accounts.ts",
      "methods": [
        {
          "endpoint": "/accounts.projects-v2-status",
          "errors": [],
          "name": "projectsV2Status",
          "param_shape": "",
          "return_envelope": "single"
        }
      ],
      "name": "accounts"
    },
    {
      "class_name": "ActivityTypesResource",
      "file": "src/resources/activity-types.ts",
      "methods": [
        {
          "endpoint": "/activityTypes.list",
          "errors": [],
          "name": "list",
          "param_shape": "RequestBody<\"<endpoint>\">",
          "return_envelope": "iterable"
        }
      ],
      "name": "activityTypes"
    },
    {
      "class_name": "BookkeepingSubmissionsResource",
      "file": "src/resources/bookkeeping-submissions.ts",
      "methods": [
        {
          "endpoint": "/bookkeepingSubmissions.list",
          "errors": [],
          "name": "list",
          "param_shape": "RequestBody<\"<endpoint>\">",
          "return_envelope": "iterable"
        }
      ],
      "name": "bookkeepingSubmissions"
    },
    {
      "class_name": "BusinessTypesResource",
      "file": "src/resources/business-types.ts",
      "methods": [
        {
          "endpoint": "/businessTypes.list",
          "errors": [],
          "name": "list",
          "param_shape": "RequestBody<\"<endpoint>\">",
          "return_envelope": "iterable"
        }
      ],
      "name": "businessTypes"
    },
    {
      "class_name": "CallOutcomesResource",
      "file": "src/resources/call-outcomes.ts",
      "methods": [
        {
          "endpoint": "/callOutcomes.list",
          "errors": [],
          "name": "list",
          "param_shape": "RequestBody<\"<endpoint>\">",
          "return_envelope": "iterable"
        }
      ],
      "name": "callOutcomes"
    },
    {
      "class_name": "CallsResource",
      "file": "src/resources/calls.ts",
      "methods": [
        {
          "endpoint": "/calls.add",
          "errors": [],
          "name": "add",
          "param_shape": "RequestBody<\"<endpoint>\">",
          "return_envelope": "single"
        },
        {
          "endpoint": "/calls.complete",
          "errors": [],
          "name": "complete",
          "param_shape": "RequestBody<\"<endpoint>\">",
          "return_envelope": "void"
        },
        {
          "endpoint": "/calls.delete",
          "errors": [],
          "name": "delete",
          "param_shape": "RequestBody<\"<endpoint>\">",
          "return_envelope": "void"
        },
        {
          "endpoint": "/calls.info",
          "errors": [],
          "name": "info",
          "param_shape": "RequestBody<\"<endpoint>\">",
          "return_envelope": "single"
        },
        {
          "endpoint": "/calls.list",
          "errors": [],
          "name": "list",
          "param_shape": "RequestBody<\"<endpoint>\">",
          "return_envelope": "iterable"
        },
        {
          "endpoint": "/calls.update",
          "errors": [],
          "name": "update",
          "param_shape": "RequestBody<\"<endpoint>\">",
          "return_envelope": "void"
        }
      ],
      "name": "calls"
    },
    {
      "class_name": "ClosingDaysResource",
      "file": "src/resources/closing-days.ts",
      "methods": [
        {
          "endpoint": "/closingDays.add",
          "errors": [],
          "name": "add",
          "param_shape": "RequestBody<\"<endpoint>\">",
          "return_envelope": "single"
        },
        {
          "endpoint": "/closingDays.delete",
          "errors": [],
          "name": "delete",
          "param_shape": "RequestBody<\"<endpoint>\">",
          "return_envelope": "void"
        },
        {
          "endpoint": "/closingDays.list",
          "errors": [],
          "name": "list",
          "param_shape": "RequestBody<\"<endpoint>\">",
          "return_envelope": "iterable"
        }
      ],
      "name": "closingDays"
    },
    {
      "class_name": "CloudPlatformsResource",
      "file": "src/resources/cloud-platforms.ts",
      "methods": [
        {
          "endpoint": "/cloudPlatforms.url",
          "errors": [],
          "name": "url",
          "param_shape": "RequestBody<\"<endpoint>\">",
          "return_envelope": "single"
        }
      ],
      "name": "cloudPlatforms"
    },
    {
      "class_name": "CommercialDiscountsResource",
      "file": "src/resources/commercial-discounts.ts",
      "methods": [
        {
          "endpoint": "/commercialDiscounts.list",
          "errors": [],
          "name": "list",
          "param_shape": "RequestBody<\"<endpoint>\">",
          "return_envelope": "iterable"
        }
      ],
      "name": "commercialDiscounts"
    },
    {
      "class_name": "CompaniesResource",
      "file": "src/resources/companies.ts",
      "methods": [
        {
          "endpoint": "/companies.add",
          "errors": [],
          "name": "add",
          "param_shape": "RequestBody<\"<endpoint>\">",
          "return_envelope": "single"
        },
        {
          "endpoint": "/companies.delete",
          "errors": [],
          "name": "delete",
          "param_shape": "RequestBody<\"<endpoint>\">",
          "return_envelope": "void"
        },
        {
          "endpoint": "/companies.info",
          "errors": [],
          "name": "info",
          "param_shape": "RequestBody<\"<endpoint>\">",
          "return_envelope": "single"
        },
        {
          "endpoint": "/companies.list",
          "errors": [],
          "name": "list",